<?xml version="1.0" encoding="UTF-8"?>
<keyage xmlns:xsi="http://www.w3.org/2001/XMLSchema-instance"
    xsi:noNamespaceSchemaLocation="http://example.com/ns/collection/keyage.xsd"
    format="1">
    <name>foo/bar</name>
    <permissions format="keymint_ros2_dds">
        <permission>
          <path>permissions1.xml</path>
        </permission>
        <permission>
          <path>permissions2.xml</path>
        </permission>
    </permissions>
    <export>
        <build_type>keymint_ros2_dds</build_type>
    </export>
</keyage>
